Track,Item,Title,Status,Depends on,Ref,Notes
A10,Phase 4f,Import unification (grid-detect any dataset; geometry section conditional),In progress,4b,,"Merges model-preflight with aux-import; biggest new surface. SCOPED 2026-06-17 (Explore-mapped the two import surfaces: model=preflight.js/#panelPreflight w/ XYZ+DXYZ+geometry; comparisons=auxtab.js/#panelAux clones, XYZ-only, geometry discarded). DECISION (Arthur): grid classification = AUTO-detect + VISIBLE + OVERRIDE (no-magic-only-ui). Slices: 4f-1 foundation · 4f-2 import UI (conditional geometry/DXYZ section + grid badge/override in dataset panels) · 4f-3 display (generalize Summary Grid-Geometry table beyond model-only lastGeoData) · 4f-4 de-special-case naming/branches. **4f-1 DONE: worker computeGeometry emits per-axis `regularity` (dominant-spacing share of gaps) + geometry-level `isRegularGrid` (all 3 axes blockSize + regularity>=0.5) — ADDITIVE (b1-differential: all 29 cases byte-identical w/ --ignore-keys=isRegularGrid,regularity; existing geometry/stats unchanged). Comparison-dataset complete handler now captures m.geometry (was discarded). dsGridMode(ds) tri-state grid/point/auto (default model='grid' [explicit block-model import], else 'auto'); dsGrid gates: blockSize-on-all-axes AND (mode grid | (auto & isRegularGrid)); point forces null. Model bit-identical (grandfathered via gridMode default). a10-smoke: model still grid, d2(model centroids) auto-detects grid, gridMode='point' override forces non-grid, aux(samples) not a grid. c6/gt-theo/topcut green. ds.gridMode override is in-memory in 4f-1; UI + persistence land in 4f-2. **4f-2 DONE (2026-06-17): Block geometry section in BOTH import surfaces (model preflight #pfGridWrap + comparison panels [data-aux=gridWrap]). Grid/point/auto override = segmented .ds-grid-chip control (model default grid, comparisons auto) + post-analysis detected badge (▦ grid <sizes> / ∴ points) w/ disagreement note — no-magic-only-ui. Shared dsGridSectionHtml(ds)+dsHasXYZ(ds) in core.js; badge refresh via refreshModelGridSection() (displayResults) + refreshAuxGridSection(ds,root) (aux complete) since neither sidebar rebuilds post-analysis. gridMode now a real registry field: model/aux views back currentGridMode/auxGridMode, dsCreate carries it for d2+. PERSIST 3 keys (preflight.gridMode/aux.gridMode/datasets[].gridMode) restored in applyProject/applyAuxRestore/wsRestoreInstance, reset at model+aux clear sites. Mode change never re-runs analysis — only flips dsHasGrid downstream (dsGridModeChanged refreshes tree today; 4f-3/4g/4h hook in later). DXYZ sub-block for comparisons scoped OUT (Arthur). NEW GUARD experiments/4f-gridmode-smoke.js (22 asserts — ADD TO REGRESSION LIST). Worker untouched: b1-differential 29/29 bit-identical. a10/c6/delta-row/4e-persist/rails/tree/dock-persist/gt-theo/swath-clone/stats-clone green. CSS NOTE: --go token is UNDEFINED (latent bug at styles.css ds-filter-est-tag--exact); success token is --green.** **4f-3 DONE (2026-06-17): Grid Geometry table generalized beyond model-only lastGeoData. Extracted geoContentHtml(geometry,totalRowCount,opts) in calcol.js (opts={coordOrder,maxDecimals,dxyz,coordInvalidCells} = model-only extras → model Summary byte-identical, a9-smoke green). renderAuxSummary prepends a Grid Geometry section when dsHasGrid(ds) — tracks the 4f-2 override live via renderAuxView; scattered keeps only Bounding Box. Geo-cell click-to-copy wired once on the aux summary container. 4f-gridmode-smoke extended (25 asserts: model table renders, forced-grid d2 shows table, point removes it). a10/c6/topcut/gt-theo/4e-persist/dock-persist/tree/drillhole/rails/delta-row/a9 green.** NEXT 4f-4.""
A10,Phase 4g,GT feature-detect (theoretical any dataset; empirical when a volume source exists),Planned,4b,,Volume source = grid geometry OR tonnage/volume column
A10,Phase 4h,Export generalize to any dataset (rows / bbox / OBJ),Planned,4b,,Points + drillholes emit the same shape
A10,Phase 5,Drillhole sets as instances (multiple); per-dataset declus/top-cut targeting,Planned,Phase 4,,
A10,Phase 6,Persistence + pack (datasets key; legacy migration; C8-shaped) + a10 persistence smoke,In progress,Phase 4; C8,0de9b02..5364059,"Datasets-key persistence + pack round-trip done in 4e-b (serialize `datasets`+`panels`, restore instances + reattach panel state, loss-safe; .bma bundles+auto-loads d2+ files; smokes 4e-persist-smoke.js + 4e-pack-smoke.js). DONE (2026-06-17): un-drop d* DATASET tabs in layout sanitize — dataset-tab DOCK POSITION now survives a reload. applyProject registers the d2+ instances in the registry (wsRestoreInstance(cfg, skipTab=true)) BEFORE wsRestoreProjectLayout, so wsSanitizeLayout (now whitelists all `datasets` ids) keeps each d* tab at its SAVED rail/stack position; the displayResults wsRestoreInstance(cfg) call now ensures-a-tab-even-if-ds-exists, so a stale/invalid layout still falls back to a default-position tab (no orphan). NEW GUARD experiments/dock-persist-smoke.js (move d2 to its own rail → reload → d2 back in its own rail, same rail count, distinct from the main stack; 6 asserts — ADD TO REGRESSION LIST). 4e-persist/4e-pack/a10/cat-persist/swath-inst-persist/stats-inst-persist/rails green. REMAINING here: C8 object shaping (align the serialized instance shape to the converged-model {datasets,reference,properties,params,title} object — tidy/refactor, not new capability); confirm legacy-project migration."
A,A6b,DGM Hermite GT engine,Planned,,,gstlearn cross-check; RGeostats avoid
A,A11,Multi-table drillholes,Planned,A7,,
A,A12,Contact analysis,Planned,A10,,
A,A13,Mesh selection / proportions (@gcu/winding + @gcu/peel),Planned,A10,,Door marked on roadmap
A,A14,Per-dataset filter from context menu + filtered-size preview,Done,A10 4c,,"Arthur 2026-06-16. Tree-ds datasetProvider gets Filter… (✓ when set) → #dsFilterModal editing that dataset's .filter (createExprInput, filter mode). Worker 'count' mode (countAnalysis: makeRowSource + src.stream, one pass, counts total + filter survivors, surfaces filterErrors/calcolErrors) → count-complete {total,kept}. Apply sets ds.filter + re-analyzes (model=startAnalysis+currentFilter sync, cmp=runAuxAnalysis which reads ds.filter; syncs an open config-panel filter textarea). Dataset-generic. INSTANT estimate (Arthur's steer — model from the t-digests, NOT the file head): dsFilterSynthEstimate Monte-Carlos 4000 synthetic rows from each column's t-digest centroids + category counts (cumulative-weight arrays, binary-searched; reuses generateSyntheticRows sampling), runs the real compiled filter (+calcols). Sort-order UNBIASED + accurate for single-column predicates (smoke: Fe>50 → modeled 55% vs exact 53%, vs the biased file HEAD's 0%). CAVEAT surfaced honestly ('modeled — assumes columns vary independently, so multi-column filters may differ'): marginals lose JOINT correlation, so multi-column filters on correlated cols can be off. Head-sniff kept only as the not-yet-analyzed fallback (labeled non-representative). Reliable size = the exact one-pass count. Smoke experiments/filter-modal-smoke.js (modeled≈exact, exact proven against post-Apply rowCount). b1-differential 29/29 bit-identical. NEXT polish if wanted: auto-exact for small files."
A,A15,Copula-modeled filter estimate (OPTIONAL — multi-column accuracy),Planned,A14,,"Optional follow-on to A14 — improves the INSTANT filtered-size estimate for MULTI-COLUMN filters on correlated columns (today dsFilterSynthEstimate samples each column's marginal independently, so joint correlation is lost). Discussed Arthur+Claude 2026-06-16. Literal multivariate t-digest = NOT a thing (no canonical total order / quantile in >=2D). Realistic path = GAUSSIAN COPULA: keep the existing per-column t-digest marginals + accumulate ONE d×d correlation matrix in the SAME analysis streaming pass (Welford sum-of-products, no extra I/O); estimate-time = Cholesky → draw correlated normals → push through each column's t-digest inverse-CDF → run the real filter. COST: memory O(d²) trivial (d=30→~3.7KB vs digests' 10s-100s KB); CPU O(d²)/row added to the analysis hot path — free at d≤~20, ~seconds at d=100 over 1M rows (CAP via top-K cols or a d-threshold). CAPTURES monotone/linear dependence (good for grades); MISSES nonlinear/tail dependence; categoricals don't fit Pearson (one-hot blows up d → keep them marginal). RECOMMENDATION (Claude): do NOT bake into the default analyze pass — it taxes a hot path for ALL users to improve ONE preview on a SUBSET of filters, and the exact one-pass count is already truth-on-tap. Build only as OPT-IN / lazy (compute the matrix only when enabled or d below a cap), or skip entirely and rely on Exact count. Single-column predicates already accurate w/o it. Needs: corr matrix in worker complete msg + analysisFingerprint + serialize/cache plumbing."
B,B0/B1/tdigest,hyparquet verify / row-source split / t-digest fix,Done,,8e27375; 33ddb50,
B,B2,Parquet platform (hyparquet everywhere),Planned,B1,,
B,B4,Parallel chunk scans,Planned,B1,,Gates the t-digest parallel-scan leftover
